{
  "schema_version": 1,
  "generated_at_utc": "2026-09-23T17:45:35Z",
  "as_of_trading_date": "2026-09-23",
  "benchmark": "SPY",
  "status": "intraday",
  "config_hash": "67788161",
  "provider": "tiingo-iex",
  "regime": {
    "state": "neutral",
    "spy_above_200sma": true,
    "pct_sectors_above_200sma": 45.5
  },
  "coverage": {
    "symbols_expected": 177,
    "symbols_ok": 177,
    "symbols_skipped": 0
  },
  "sectors": [
    {
      "ticker": "XLK",
      "name": "Technology",
      "rss": 0.0521,
      "rss_rank": 99,
      "rss_slope": 0.0024,
      "rss_persist": 6,
      "trend": "positive",
      "breakout": false,
      "map_50": 73.3333,
      "map_200": 66.6667,
      "map_band": "mid",
      "rally_flag": false,
      "breadth_divergence": false,
      "udvr": null,
      "map_granularity_pct": 6.7,
      "rss_sparkline": [
        -0.0107,
        0.0144,
        -0.0192,
        0.0051,
        -0.0096,
        -0.0344,
        -0.0399,
        -0.012,
        -0.0018,
        0.0005,
        -0.0082,
        -0.0146,
        -0.0176,
        -0.0065,
        -0.0004,
        0.0258,
        0.0248,
        0.0339,
        0.0464,
        0.0521
      ],
      "other_count": 14,
      "leaders": [],
      "setups": [
        {
          "ticker": "TXN",
          "name": "TXN",
          "classification": "SETUP",
          "pct_from_sma50": -0.7031,
          "atr_ratio": 0.6509,
          "vol_contraction": true,
          "above_sma200": true
        }
      ]
    },
    {
      "ticker": "XLE",
      "name": "Energy",
      "rss": 0.0282,
      "rss_rank": 89,
      "rss_slope": 0.0001,
      "rss_persist": 10,
      "trend": "positive",
      "breakout": false,
      "map_50": 53.3333,
      "map_200": 93.3333,
      "map_band": "mid",
      "rally_flag": false,
      "breadth_divergence": false,
      "udvr": null,
      "map_granularity_pct": 6.7,
      "rss_sparkline": [
        0.0393,
        0.017,
        0.0565,
        0.0787,
        0.1103,
        0.13,
        0.1118,
        0.0893,
        0.1007,
        0.101,
        0.1106,
        0.1191,
        0.1125,
        0.1261,
        0.0966,
        0.077,
        0.0631,
        0.0325,
        0.0179,
        0.0282
      ],
      "other_count": 11,
      "leaders": [],
      "setups": [
        {
          "ticker": "WMB",
          "name": "WMB",
          "classification": "SETUP",
          "pct_from_sma50": -1.3626,
          "atr_ratio": 0.5795,
          "vol_contraction": true,
          "above_sma200": true
        },
        {
          "ticker": "KMI",
          "name": "KMI",
          "classification": "SETUP",
          "pct_from_sma50": -0.0891,
          "atr_ratio": 0.6624,
          "vol_contraction": true,
          "above_sma200": true
        },
        {
          "ticker": "SLB",
          "name": "SLB",
          "classification": "SETUP",
          "pct_from_sma50": -0.8484,
          "atr_ratio": 0.7033,
          "vol_contraction": true,
          "above_sma200": true
        },
        {
          "ticker": "TRGP",
          "name": "TRGP",
          "classification": "SETUP",
          "pct_from_sma50": 1.6168,
          "atr_ratio": 0.7199,
          "vol_contraction": true,
          "above_sma200": true
        }
      ]
    },
    {
      "ticker": "XLV",
      "name": "Health Care",
      "rss": -0.0065,
      "rss_rank": 79,
      "rss_slope": -0.0013,
      "rss_persist": 10,
      "trend": "negative",
      "breakout": false,
      "map_50": 73.3333,
      "map_200": 86.6667,
      "map_band": "mid",
      "rally_flag": false,
      "breadth_divergence": false,
      "udvr": null,
      "map_granularity_pct": 6.7,
      "rss_sparkline": [
        0.0409,
        0.0258,
        0.0456,
        0.0451,
        0.0644,
        0.0846,
        0.0692,
        0.0473,
        0.0179,
        0.0097,
        -0.0021,
        0.0019,
        0.0198,
        0.0134,
        0.0212,
        -0.0037,
        0.0052,
        -0.0083,
        0.0015,
        -0.0065
      ],
      "other_count": 11,
      "leaders": [],
      "setups": [
        {
          "ticker": "LLY",
          "name": "LLY",
          "classification": "SETUP",
          "pct_from_sma50": -2.0923,
          "atr_ratio": 0.4384,
          "vol_contraction": true,
          "above_sma200": true
        },
        {
          "ticker": "MDT",
          "name": "MDT",
          "classification": "SETUP",
          "pct_from_sma50": 0.3556,
          "atr_ratio": 0.5546,
          "vol_contraction": true,
          "above_sma200": true
        },
        {
          "ticker": "JNJ",
          "name": "JNJ",
          "classification": "SETUP",
          "pct_from_sma50": 1.3304,
          "atr_ratio": 0.5602,
          "vol_contraction": true,
          "above_sma200": true
        },
        {
          "ticker": "ELV",
          "name": "ELV",
          "classification": "SETUP",
          "pct_from_sma50": 0.534,
          "atr_ratio": 0.5661,
          "vol_contraction": true,
          "above_sma200": true
        }
      ]
    },
    {
      "ticker": "XLC",
      "name": "Communication Services",
      "rss": -0.0106,
      "rss_rank": 70,
      "rss_slope": 0.0009,
      "rss_persist": 10,
      "trend": "negative",
      "breakout": false,
      "map_50": 40.0,
      "map_200": 46.6667,
      "map_band": "low",
      "rally_flag": false,
      "breadth_divergence": false,
      "udvr": null,
      "map_granularity_pct": 6.7,
      "rss_sparkline": [
        -0.0157,
        -0.0329,
        0.0025,
        -0.0165,
        -0.0121,
        0.0058,
        0.019,
        -0.0029,
        0.0033,
        0.0072,
        0.0146,
        0.0197,
        0.0331,
        0.0327,
        0.0288,
        0.0017,
        -0.0065,
        0.0065,
        -0.0094,
        -0.0106
      ],
      "other_count": 13,
      "leaders": [],
      "setups": [
        {
          "ticker": "EA",
          "name": "EA",
          "classification": "SETUP",
          "pct_from_sma50": 0.1269,
          "atr_ratio": 0.0339,
          "vol_contraction": true,
          "above_sma200": true
        },
        {
          "ticker": "GOOGL",
          "name": "GOOGL",
          "classification": "SETUP",
          "pct_from_sma50": -1.8188,
          "atr_ratio": 0.6346,
          "vol_contraction": true,
          "above_sma200": true
        }
      ]
    },
    {
      "ticker": "XLB",
      "name": "Materials",
      "rss": -0.0364,
      "rss_rank": 60,
      "rss_slope": -0.0036,
      "rss_persist": 0,
      "trend": "negative",
      "breakout": false,
      "map_50": 20.0,
      "map_200": 53.3333,
      "map_band": "low",
      "rally_flag": false,
      "breadth_divergence": false,
      "udvr": null,
      "map_granularity_pct": 6.7,
      "rss_sparkline": [
        0.0077,
        -0.0161,
        -0.007,
        -0.0098,
        -0.0129,
        0.0059,
        -0.0136,
        -0.0113,
        -0.0212,
        -0.0333,
        -0.0216,
        -0.0172,
        -0.0263,
        -0.0261,
        -0.0226,
        -0.0271,
        -0.0295,
        -0.0515,
        -0.042,
        -0.0364
      ],
      "other_count": 14,
      "leaders": [],
      "setups": [
        {
          "ticker": "ECL",
          "name": "ECL",
          "classification": "SETUP",
          "pct_from_sma50": -0.2338,
          "atr_ratio": 0.469,
          "vol_contraction": true,
          "above_sma200": true
        }
      ]
    },
    {
      "ticker": "XLP",
      "name": "Consumer Staples",
      "rss": -0.0464,
      "rss_rank": 50,
      "rss_slope": -0.002,
      "rss_persist": 0,
      "trend": "negative",
      "breakout": false,
      "map_50": 40.0,
      "map_200": 40.0,
      "map_band": "low",
      "rally_flag": false,
      "breadth_divergence": false,
      "udvr": null,
      "map_granularity_pct": 6.7,
      "rss_sparkline": [
        -0.0235,
        -0.0489,
        -0.0208,
        -0.0273,
        -0.0045,
        0.006,
        -0.0022,
        -0.024,
        -0.0269,
        -0.0322,
        -0.0241,
        -0.0159,
        -0.0011,
        -0.0117,
        -0.0063,
        -0.0265,
        -0.0297,
        -0.0489,
        -0.0475,
        -0.0464
      ],
      "other_count": 9,
      "leaders": [],
      "setups": [
        {
          "ticker": "MDLZ",
          "name": "MDLZ",
          "classification": "SETUP",
          "pct_from_sma50": -1.5167,
          "atr_ratio": 0.4325,
          "vol_contraction": true,
          "above_sma200": true
        },
        {
          "ticker": "PG",
          "name": "PG",
          "classification": "SETUP",
          "pct_from_sma50": 1.1578,
          "atr_ratio": 0.4399,
          "vol_contraction": true,
          "above_sma200": true
        },
        {
          "ticker": "PM",
          "name": "PM",
          "classification": "SETUP",
          "pct_from_sma50": 0.9122,
          "atr_ratio": 0.5564,
          "vol_contraction": true,
          "above_sma200": true
        },
        {
          "ticker": "MO",
          "name": "MO",
          "classification": "SETUP",
          "pct_from_sma50": 0.5177,
          "atr_ratio": 0.6046,
          "vol_contraction": true,
          "above_sma200": true
        },
        {
          "ticker": "KO",
          "name": "KO",
          "classification": "SETUP",
          "pct_from_sma50": 0.9955,
          "atr_ratio": 0.6601,
          "vol_contraction": true,
          "above_sma200": true
        },
        {
          "ticker": "TGT",
          "name": "TGT",
          "classification": "SETUP",
          "pct_from_sma50": 2.835,
          "atr_ratio": 0.7472,
          "vol_contraction": true,
          "above_sma200": true
        }
      ]
    },
    {
      "ticker": "XLF",
      "name": "Financials",
      "rss": -0.0518,
      "rss_rank": 40,
      "rss_slope": -0.0028,
      "rss_persist": 4,